{
  "$schema": "http://json-schema.org/draft-06/schema#",
  "id": "http://hl7.org/fhir/json-schema/DeviceUseStatement",
  "description": "A record of a device being used by a patient where the record is the result of a report from the patient or another clinician.",
  "type": "object",
  "required": ["resourceType", "status", "subject", "device"],
  "properties": {
    "resourceType": { "const": "DeviceUseStatement" },
    "id": { "type": "string", "description": "Logical id of this artifact" },
    "_id": { "type": "string", "description": "MongoDB primary key" },
    "meta": { "type": "object", "properties": { "versionId": { "type": "string" }, "lastUpdated": { "type": "string" }, "source": { "type": "string" }, "profile": { "type": "array", "items": { "type": "string" } }, "security": { "type": "array", "items": { "type": "object", "properties": { "system": { "type": "string" }, "code": { "type": "string" }, "display": { "type": "string" } } } }, "tag": { "type": "array", "items": { "type": "object", "properties": { "system": { "type": "string" }, "code": { "type": "string" }, "display": { "type": "string" } } } } } },
    "implicitRules": { "type": "string" },
    "language": { "type": "string" },
    "text": { "type": "object", "properties": { "status": { "type": "string" }, "div": { "type": "string" } } },
    "contained": { "type": "array", "items": { "type": "object" } },
    "extension": { "type": "array", "items": { "type": "object" } },
    "modifierExtension": { "type": "array", "items": { "type": "object" } },
    "identifier": { "type": "array", "items": { "type": "object", "properties": { "use": { "type": "string" }, "system": { "type": "string" }, "value": { "type": "string" } } } },
    "basedOn": { "type": "array", "items": { "type": "object", "properties": { "reference": { "type": "string" }, "display": { "type": "string" } } } },
    "status": { "type": "string", "enum": ["active", "completed", "entered-in-error", "intended", "stopped", "on-hold"] },
    "subject": { "type": "object", "properties": { "reference": { "type": "string" }, "display": { "type": "string" } } },
    "derivedFrom": { "type": "array", "items": { "type": "object", "properties": { "reference": { "type": "string" }, "display": { "type": "string" } } } },
    "timingTiming": { "type": "object" },
    "timingPeriod": { "type": "object", "properties": { "start": { "type": "string" }, "end": { "type": "string" } } },
    "timingDateTime": { "type": "string" },
    "recordedOn": { "type": "string" },
    "source": { "type": "object", "properties": { "reference": { "type": "string" }, "display": { "type": "string" } } },
    "device": { "type": "object", "properties": { "reference": { "type": "string" }, "display": { "type": "string" } } },
    "reasonCode": { "type": "array", "items": { "type": "object", "properties": { "coding": { "type": "array", "items": { "type": "object", "properties": { "system": { "type": "string" }, "code": { "type": "string" }, "display": { "type": "string" } } } }, "text": { "type": "string" } } } },
    "reasonReference": { "type": "array", "items": { "type": "object", "properties": { "reference": { "type": "string" }, "display": { "type": "string" } } } },
    "bodySite": { "type": "object", "properties": { "coding": { "type": "array", "items": { "type": "object", "properties": { "system": { "type": "string" }, "code": { "type": "string" }, "display": { "type": "string" } } } }, "text": { "type": "string" } } },
    "note": { "type": "array", "items": { "type": "object", "properties": { "authorReference": { "type": "object" }, "authorString": { "type": "string" }, "time": { "type": "string" }, "text": { "type": "string" } } } }
  }
}
